{
  "schema_version": "1.0",
  "handoff_id": "handoff_0001",
  "direction": "tutor_to_assessment",
  "task": "create_quiz",
  "context": {
    "learner_session_id": "session_0001",
    "round": "first"
  },
  "sources": [
    {
      "lesson_id": "lesson_cell_membranes",
      "lesson_version": 2,
      "url": "https://cellandmolecularbiology.pressbooks.tru.ca/chapter/2-1/",
      "license": "CC BY-NC-SA 4.0",
      "attribution": "Cell & Molecular Biology, Marg Sonnenfeld and Jonathan (Jung Lynn) Jung, Thompson Rivers University"
    }
  ],
  "expected_output": "Exactly 10 multiple-choice questions, each with four options (a-d) and one concept_id from payload.concepts. Test only the explanation_text. Return a private answer key to the controller, never the learner or Tutor.",
  "uncertainty": {
    "level": "low",
    "reasons": [
      "This is a hand-written development fixture, not a live Tutor response.",
      "The explanation intentionally omits membrane protein types, lipid rafts, detailed enzyme mechanisms, and numerical fluidity predictions. Do not quiz those details."
    ]
  },
  "payload": {
    "lesson_id": "lesson_cell_membranes",
    "lesson_version": 2,
    "explanation_id": "expl_0001",
    "explanation_text": "A cell membrane is a flexible boundary. Phospholipids have water-loving heads and water-avoiding tails: this combination is called amphipathic. They form a bilayer with heads toward water on both sides and tails tucked inside. Saturated fatty acid tails pack closely. Double bonds kink unsaturated tails, making close packing harder and increasing fluidity. Fluidity describes how freely membrane components move. Tail saturation, chain length, temperature, and cholesterol affect it. Cholesterol buffers fluidity: it restrains movement when the membrane is very fluid and prevents excessive stiffening in the cold. The fluid mosaic model describes a mixture of lipids, cholesterol, and proteins whose components can move sideways. The two membrane layers, or leaflets, differ in composition. Lipids rarely switch leaflets without enzymes such as flippases, floppases, and scramblases. Sugars on the outer surface form the glycocalyx and help cells recognize one another, including distinguishing self from non-self.",
    "concepts": [
      {
        "concept_id": "c_amphipathic_phospholipids",
        "name": "Amphipathic phospholipids form the bilayer",
        "taught_summary": "Amphipathic phospholipids form a bilayer: water-loving heads face water on both sides; water-avoiding tails face inward."
      },
      {
        "concept_id": "c_fatty_acid_saturation",
        "name": "Saturated vs. unsaturated fatty acids",
        "taught_summary": "Saturated tails pack closely; double bonds kink unsaturated tails, hindering close packing and increasing fluidity."
      },
      {
        "concept_id": "c_fluidity_factors",
        "name": "What affects membrane fluidity",
        "taught_summary": "Membrane fluidity is affected by tail saturation, chain length, temperature, and cholesterol."
      },
      {
        "concept_id": "c_cholesterol_buffer",
        "name": "Cholesterol as a fluidity buffer",
        "taught_summary": "Cholesterol restrains movement in a very fluid membrane and prevents excessive stiffening in the cold."
      },
      {
        "concept_id": "c_fluid_mosaic_model",
        "name": "Fluid mosaic model",
        "taught_summary": "The fluid mosaic model describes lipids, cholesterol, and proteins with components able to move sideways."
      },
      {
        "concept_id": "c_membrane_asymmetry",
        "name": "Membrane asymmetry and lipid flipping",
        "taught_summary": "Leaflets differ in composition; switching leaflets is rare without flippases, floppases, or scramblases."
      },
      {
        "concept_id": "c_glycocalyx_recognition",
        "name": "Glycocalyx and cell recognition",
        "taught_summary": "Outer-surface sugars form the glycocalyx and support cell recognition and self/non-self distinction."
      }
    ]
  }
}
